{
  "$schema": "https://json-schema.org/draft/2020-12/schema",
  "title": "Checkbook",
  "description": "Schema for a personal or business checkbook including transactions and balances",
  "version": "1.0.0",
  "type": "object",
  "properties": {
    "accountInfo": {
      "type": "object",
      "properties": {
        "accountId": {
          "type": "string",
          "description": "Unique identifier for the account"
        },
        "accountType": {
          "type": "string",
          "enum": ["Personal", "Business", "Joint"],
          "description": "Type of checking account"
        },
        "accountNumber": {
          "type": "string",
          "description": "Bank account number"
        },
        "routingNumber": {
          "type": "string",
          "pattern": "^\\d{9}$",
          "description": "Bank routing number (9 digits)"
        },
        "bankName": {
          "type": "string",
          "description": "Name of the bank"
        },
        "bankBranch": {
          "type": "string",
          "description": "Branch name or location"
        },
        "accountHolders": {
          "type": "array",
          "items": {
            "type": "object",
            "properties": {
              "firstName": { "type": "string" },
              "lastName": { "type": "string" },
              "type": {
                "type": "string",
                "enum": ["Primary", "Secondary", "Authorized Signer"]
              }
            },
            "required": ["firstName", "lastName", "type"]
          },
          "minItems": 1
        }
      },
      "required": ["accountId", "accountType", "accountNumber", "routingNumber", "bankName"]
    },
    "balances": {
      "type": "object",
      "properties": {
        "currentBalance": {
          "type": "number",
          "description": "Current account balance"
        },
        "availableBalance": {
          "type": "number",
          "description": "Available balance (considering pending transactions)"
        },
        "lastReconciled": {
          "type": "string",
          "format": "date",
          "description": "Date of last reconciliation"
        },
        "lastReconciledBalance": {
          "type": "number",
          "description": "Balance at last reconciliation"
        }
      },
      "required": ["currentBalance", "availableBalance"]
    },
    "transactions": {
      "type": "array",
      "items": {
        "type": "object",
        "properties": {
          "transactionId": {
            "type": "string",
            "description": "Unique identifier for the transaction"
          },
          "date": {
            "type": "string",
            "format": "date",
            "description": "Date of the transaction"
          },
          "postDate": {
            "type": "string",
            "format": "date",
            "description": "Date the transaction posted to the account"
          },
          "type": {
            "type": "string",
            "enum": [
              "Check",
              "Deposit",
              "ATM",
              "Transfer",
              "ACH",
              "Wire",
              "Fee",
              "Interest",
              "Other"
            ],
            "description": "Type of transaction"
          },
          "checkNumber": {
            "type": "string",
            "description": "Check number if transaction is a check"
          },
          "payee": {
            "type": "string",
            "description": "Name of payee or source of transaction"
          },
          "memo": {
            "type": "string",
            "description": "Transaction memo or note"
          },
          "category": {
            "type": "string",
            "description": "Transaction category for budgeting"
          },
          "amount": {
            "type": "number",
            "description": "Transaction amount (negative for debits, positive for credits)"
          },
          "status": {
            "type": "string",
            "enum": ["Pending", "Cleared", "Reconciled", "Voided"],
            "description": "Current status of the transaction"
          },
          "tags": {
            "type": "array",
            "items": {
              "type": "string"
            },
            "description": "Custom tags for transaction categorization"
          },
          "image": {
            "type": "object",
            "properties": {
              "front": {
                "type": "string",
                "format": "uri",
                "description": "URL to front image of check"
              },
              "back": {
                "type": "string",
                "format": "uri",
                "description": "URL to back image of check"
              }
            }
          }
        },
        "required": ["transactionId", "date", "type", "amount", "status"]
      }
    },
    "checkRegistry": {
      "type": "object",
      "properties": {
        "nextCheckNumber": {
          "type": "string",
          "description": "Next available check number"
        },
        "checkRange": {
          "type": "object",
          "properties": {
            "start": { "type": "string" },
            "end": { "type": "string" }
          },
          "description": "Range of check numbers in current book"
        },
        "voidedChecks": {
          "type": "array",
          "items": {
            "type": "string"
          },
          "description": "List of voided check numbers"
        }
      },
      "required": ["nextCheckNumber"]
    },
    "settings": {
      "type": "object",
      "properties": {
        "defaultCategories": {
          "type": "array",
          "items": {
            "type": "string"
          },
          "description": "List of predefined transaction categories"
        },
        "minimumBalance": {
          "type": "number",
          "description": "Minimum balance to maintain"
        },
        "overdraftProtection": {
          "type": "boolean",
          "description": "Whether overdraft protection is enabled"
        },
        "notificationPreferences": {
          "type": "object",
          "properties": {
            "lowBalance": { "type": "boolean" },
            "largeTransactions": { "type": "boolean" },
            "checkCleared": { "type": "boolean" }
          }
        }
      }
    }
  },
  "required": ["accountInfo", "balances", "transactions"]
} 