{
  "accountInfo": {
    "accountId": "CHK-12345",
    "accountType": "Personal",
    "accountNumber": "1234567890",
    "routingNumber": "123456789",
    "bankName": "First National Bank",
    "bankBranch": "Main Street Branch",
    "accountHolders": [
      {
        "firstName": "John",
        "lastName": "Doe",
        "type": "Primary"
      },
      {
        "firstName": "Jane",
        "lastName": "Doe",
        "type": "Secondary"
      }
    ]
  },
  "balances": {
    "currentBalance": 2547.82,
    "availableBalance": 2247.82,
    "lastReconciled": "2024-03-15",
    "lastReconciledBalance": 2547.82
  },
  "transactions": [
    {
      "transactionId": "TXN-001",
      "date": "2024-03-15",
      "postDate": "2024-03-15",
      "type": "Check",
      "checkNumber": "1001",
      "payee": "Acme Utilities",
      "memo": "March Utilities Payment",
      "category": "Utilities",
      "amount": -150.00,
      "status": "Cleared",
      "tags": ["bills", "monthly", "utilities"],
      "image": {
        "front": "https://bank.example.com/checks/1001-front.jpg",
        "back": "https://bank.example.com/checks/1001-back.jpg"
      }
    },
    {
      "transactionId": "TXN-002",
      "date": "2024-03-16",
      "type": "Deposit",
      "payee": "Employer Inc",
      "memo": "Direct Deposit - Payroll",
      "category": "Income",
      "amount": 2500.00,
      "status": "Cleared",
      "tags": ["income", "salary"]
    },
    {
      "transactionId": "TXN-003",
      "date": "2024-03-17",
      "type": "ATM",
      "payee": "ATM Withdrawal",
      "amount": -100.00,
      "status": "Pending",
      "tags": ["cash", "withdrawal"]
    }
  ],
  "checkRegistry": {
    "nextCheckNumber": "1002",
    "checkRange": {
      "start": "1001",
      "end": "1100"
    },
    "voidedChecks": []
  },
  "settings": {
    "defaultCategories": [
      "Utilities",
      "Rent",
      "Groceries",
      "Transportation",
      "Entertainment",
      "Healthcare",
      "Income"
    ],
    "minimumBalance": 1000.00,
    "overdraftProtection": true,
    "notificationPreferences": {
      "lowBalance": true,
      "largeTransactions": true,
      "checkCleared": true
    }
  }
} 